{
  "manifest_version": "phase2a-cutover-v1",
  "implementation_commit_sha": "6d967b418521131bee888ef9b889c161a83ab308",
  "core_config_sha256": "064ead6f00a462aa055e1ac813bdec71a92d3b038c692d32e54112fdd700e85f",
  "scope_name": "主要500+Growth",
  "scope_member_count": 965,
  "scope_member_sha256": "459b956942a3e3a7e430f60eacfa5f99a5ba3ae9c296fb1e9333f6397c285f79",
  "expected_market_date": "2026-09-11",
  "market_session_index": 0,
  "state_machine_version": "sm1",
  "threshold_version": "smt1",
  "identity_version": "csu1",
  "decision_rule_version": "idr1",
  "identity_epoch": "phase2a-cutover-v1",
  "automatic_closed_enabled": false,
  "approved_at": "2026-09-13T00:34:03+09:00"
}
